{
  "schema_id": "prism-session-manifest",
  "task_id": "20260606-human-facing-chinese-policy-timeout-followups",
  "run_dir": "/Users/norven/workspace/AI Era/redcap/assets/evidence/prism/20260606-human-facing-chinese-policy-timeout-followups",
  "status": "escalated",
  "max_rounds_per_provider": 3,
  "created_at": "2026-06-06T03:47:53+00:00",
  "updated_at": "2026-06-06T03:54:17+00:00",
  "providers": {
    "claude-code": {
      "session_handle": "90eeee2f-4ea4-41ef-83be-f33ccedb4eb4",
      "round_count": 0,
      "status": "expired",
      "last_review": null
    },
    "kimi": {
      "session_handle": null,
      "round_count": 0,
      "status": "expired",
      "last_review": null
    }
  },
  "convergence": {
    "state": "escalated",
    "reason": "Both required Prism providers failed to return a valid review within bounded dispatcher timeouts; Claude Code also failed a minimal no-tools probe."
  }
}
