{
  "schema_id": "prism-session-manifest",
  "task_id": "20260606-development-lifecycle-review",
  "run_dir": "/Users/norven/workspace/AI Era/redcap/assets/evidence/prism/20260606-development-lifecycle-review",
  "status": "converged",
  "max_rounds_per_provider": 3,
  "created_at": "2026-06-06T07:41:51+00:00",
  "updated_at": "2026-06-06T08:06:27+00:00",
  "providers": {
    "claude-code": {
      "session_handle": "569d33c8-b727-4e0e-8cb7-c9ece53cd4cb",
      "round_count": 3,
      "status": "converged",
      "last_review": "assets/evidence/prism/20260606-development-lifecycle-review/claude-code.followup2.review.json"
    },
    "kimi": {
      "session_handle": "01d0526e-ebea-4610-8c87-b43250587a2c",
      "round_count": 3,
      "status": "converged",
      "last_review": "assets/evidence/prism/20260606-development-lifecycle-review/kimi.followup2.review.json"
    }
  },
  "convergence": {
    "state": "converged",
    "reason": "Third Prism round passed after negative lifecycle gate tests and disclosure of enforcement-matrix change."
  }
}
