{
  "schema_id": "prism-session-manifest",
  "task_id": "20260606-stop-hook-reanchor",
  "run_dir": "/Users/norven/workspace/AI Era/redcap/assets/evidence/prism/20260606-stop-hook-reanchor",
  "status": "main-decided",
  "max_rounds_per_provider": 3,
  "created_at": "2026-06-05T18:19:21+00:00",
  "updated_at": "2026-06-05T18:43:58+00:00",
  "providers": {
    "claude-code": {
      "session_handle": "7a09b742-1cb1-4384-b42b-7f19543c0ecf",
      "round_count": 1,
      "status": "converged",
      "last_review": "assets/evidence/prism/20260606-stop-hook-reanchor/claude-code.review.json"
    },
    "kimi": {
      "session_handle": null,
      "round_count": 0,
      "status": "expired",
      "last_review": null
    }
  },
  "convergence": {
    "state": "main-decided",
    "reason": "Cap accepted the claude-code concern and implemented structured task-anchor propagation; kimi expired without a review and was not treated as approval."
  }
}
